{"$id":"https://dji.com/schemas/fh2-plugin-contract/plugin.schema.json","$schema":"http://json-schema.org/draft-07/schema#","additionalProperties":false,"properties":{"allowlist":{"items":{"enum":["cache:read","cache:write","config:get","data:read","data:write","egress:fetch","event:write","flow:start","geo.segment:read","integration.gis:read","integration:write","media:read","media:write","notify:publish","screenshot:issueupload","screenshot:signurl","track:read","video:process","wayline:generate"],"type":"string"},"type":"array"},"connections":{"items":{"additionalProperties":false,"properties":{"description":{"type":"string"},"id":{"type":"string"},"requires":{"items":{"additionalProperties":false,"properties":{"description":{"type":"string"},"name":{"type":"string"},"required":{"type":"boolean"},"secret":{"type":"boolean"},"type":{"type":"string"}},"required":["name","type"],"type":"object"},"type":"array"}},"required":["id"],"type":"object"},"type":"array"},"contractsRange":{"type":"string"},"description":{"type":"string"},"entities":{"items":{"additionalProperties":false,"properties":{"fields":{"additionalProperties":{"additionalProperties":false,"properties":{"indexed":{"type":"boolean"},"type":{"enum":["boolean","datetime","json","number","string"],"type":"string"},"unique":{"type":"boolean"}},"required":["type"],"type":"object"},"maxProperties":64,"minProperties":1,"propertyNames":{"anyOf":[{"pattern":"^[a-z][A-Za-z0-9]*$"},{"pattern":"^[a-z][a-z0-9]*(?:_[a-z0-9]+)*$"}],"not":{"enum":["cmax","cmin","created_at","ctid","id","tableoid","tenant_id","updated_at","xmax","xmin"]}},"type":"object"},"name":{"maxLength":53,"pattern":"^[a-z][a-z0-9_]*$","type":"string"}},"required":["name","fields"],"type":"object"},"maxItems":32,"type":"array"},"evaluators":{"items":{"additionalProperties":false,"anyOf":[{"required":["entry"]},{"required":["path"]}],"properties":{"description":{"type":"string"},"entry":{"type":"string"},"io":{"additionalProperties":false,"properties":{"inputs":{"items":{"additionalProperties":false,"properties":{"fields":{"items":{},"type":"array"},"name":{"type":"string"},"required":{"type":"boolean"},"type":{"type":"string"}},"required":["name","required","type"],"type":"object"},"type":"array"},"outputs":{"items":{"additionalProperties":false,"properties":{"fields":{"items":{},"type":"array"},"name":{"type":"string"},"required":{"type":"boolean"},"type":{"type":"string"}},"required":["name","required","type"],"type":"object"},"type":"array"}},"required":["inputs","outputs"],"type":"object"},"name":{"type":"string"},"path":{"type":"string"}},"required":["name"],"type":"object"},"type":"array"},"eventStatuses":{"items":{"type":"string"},"type":"array"},"events":{"items":{"additionalProperties":false,"properties":{"consumer":{"items":{"additionalProperties":false,"anyOf":[{"required":["entry"]},{"required":["handler"]}],"properties":{"entry":{"type":"string"},"handler":{"type":"string"}},"required":[],"type":"object"},"minItems":1,"type":"array"},"description":{"type":"string"},"match":{"additionalProperties":{"type":"string"},"type":"object"},"type":{"type":"string"}},"required":["consumer","type"],"type":"object"},"type":"array"},"flows":{"items":{"type":"string"},"type":"array"},"name":{"type":"string"},"pluginId":{"type":"string"},"puid":{"type":"string"},"scripts":{"items":{"additionalProperties":false,"anyOf":[{"required":["entry"]},{"required":["path"]}],"properties":{"allowlist":{"items":{"enum":["cache:read","cache:write","config:get","data:read","data:write","egress:fetch","event:write","flow:start","geo.segment:read","integration.gis:read","integration:write","media:read","media:write","notify:publish","screenshot:issueupload","screenshot:signurl","track:read","video:process","wayline:generate"],"type":"string"},"type":"array"},"description":{"type":"string"},"entry":{"type":"string"},"io":{"additionalProperties":false,"properties":{"inputs":{"items":{"additionalProperties":false,"properties":{"fields":{"items":{},"type":"array"},"name":{"type":"string"},"required":{"type":"boolean"},"type":{"type":"string"}},"required":["name","required","type"],"type":"object"},"type":"array"},"outputs":{"items":{"additionalProperties":false,"properties":{"fields":{"items":{},"type":"array"},"name":{"type":"string"},"required":{"type":"boolean"},"type":{"type":"string"}},"required":["name","required","type"],"type":"object"},"type":"array"}},"required":["inputs","outputs"],"type":"object"},"name":{"type":"string"},"path":{"type":"string"}},"required":[],"type":"object"},"type":"array"},"slots":{"items":{"type":"string"},"type":"array"},"version":{"type":"string"}},"required":["name","pluginId","version"],"title":"FH2 backend runtime plugin.json","type":"object"}
